<?xml version="1.0" encoding="windows-1252"?>
<plsql-core-module  xmlns:xsi='http://www.w3.org/2001/XMLSchema-instance'
   xmlns='http://plsql-core.butterfill.com/schema/plsql-core-module'
   xsi:schemaLocation='http://plsql-core.butterfill.com/schema/plsql-core-module plsql-core-module.xsd'>
    <location>http://plsql-core.googlecode.com/svn/trunk/plsql-core/src/main/sql/constants/</location>
    <version>0.1</version>
    <file-set>
        <file>build.sql</file>
        <file>drop.sql</file>
        <file>index.html</file>
        <file>constants.spc</file>
    </file-set>
</plsql-core-module>
