<?xml version="1.0" encoding="windows-1252"?>
<plsql-core-module  xmlns:xsi='http://www.w3.org/2001/XMLSchema-instance'
   xmlns='http://plsql-core.butterfill.com/schema/plsql-core-module'
   xsi:schemaLocation='http://plsql-core.butterfill.com/schema/plsql-core-module plsql-core-module.xsd'>
    <location>http://plsql-core.googlecode.com/svn/trunk/plsql-core/trunk/src/main/sql/logger/</location>
    <version>0.1</version>
    <file-set>
        <file>build.sql</file>
        <file>drop.sql</file>
        <file>index.html</file>
        <file>logger.bdy</file>
        <file>logger.spc</file>
        <file>logger_error.spc</file>
        <file>logger_error_post_10.bdy</file>
        <file>logger_error_pre_10.bdy</file>
        <file>logger_feedback.bdy</file>
        <file>logger_feedback.spc</file>
        <file>logger_stack_utils.bdy</file>
        <file>logger_stack_utils.spc</file>
        <file>logger_utils.bdy</file>
        <file>logger_utils.spc</file>
    </file-set>
</plsql-core-module>
