<?xml version="1.0" encoding="windows-1252"?>
<plsql-core-module  xmlns:xsi='http://www.w3.org/2001/XMLSchema-instance'
   xmlns='http://plsql-core.butterfill.com/schema/plsql-core-module'
   xsi:schemaLocation='http://plsql-core.butterfill.com/schema/plsql-core-module plsql-core-module.xsd'>
    <location>http://plsql-core.googlecode.com/svn/trunk/plsql-core/trunk/src/main/resources/plsql/properties/utilities/</location>
    <version>0.1</version>
    <file-set>
        <file>extract-to-java.sql</file>
        <file>extract-to-plsql.sql</file>
    </file-set>
    <dependencies>
        <dependency>
            <location>http://plsql-core.googlecode.com/svn/trunk/plsql-core/trunk/src/main/resources/plsql/properties/</location>
        </dependency>
    </dependencies>
</plsql-core-module>
