<?xml version="1.0" encoding="windows-1252"?>
<plsql-core-module  xmlns:xsi='http://www.w3.org/2001/XMLSchema-instance'
   xmlns='http://plsql-core.butterfill.com/schema/plsql-core-module'
   xsi:schemaLocation='http://plsql-core.butterfill.com/schema/plsql-core-module plsql-core-module.xsd'>
    <location>http://plsql-core.googlecode.com/svn/trunk/plsql-core/src/main/sql/properties/admin/</location>
    <version>0.1</version>
    <file-set>
        <file>build.sql</file>
        <file>drop.sql</file>
        <file>index.html</file>
        <file>property_group.spc</file>
        <file>property_group.bdy</file>
        <file>property_key.spc</file>
        <file>property_key.bdy</file>
        <file>property_value.spc</file>
        <file>property_value.bdy</file>
    </file-set>
    <dependencies>
        <dependency>
            <location>http://plsql-core.googlecode.com/svn/trunk/plsql-core/src/main/sql/properties/</location>
        </dependency>
        <dependency>
            <location>http://plsql-core.googlecode.com/svn/trunk/plsql-core/src/main/sql/logger/</location>
        </dependency>
        <dependency>
            <location>http://plsql-core.googlecode.com/svn/trunk/plsql-core/src/main/sql/messages/</location>
        </dependency>
    </dependencies>
</plsql-core-module>
